ID,Title,Description,Acceptance,Test_Method,Tools,Dev_Status,Review1_Status,Regression_Status,Files,Dependencies,Notes
DOCS-005,[P0][docs] 生成第五批 quality-guardrails 计划资产,为 seed preferences、quality guardrails、CLI 过滤参数生成第五批 plan/issue csv 并更新路线图文档。,存在匹配 timestamp/slug 的 plan 与 issue csv；路线图反映 quality guardrails 目标。,python .codex/skills/plan/scripts/validate_issues_csv.py issues/2026-03-17_18-57-08-pixiv-quality-guardrails.csv,none,DONE,DONE,TODO,plan/2026-03-17_18-57-08-pixiv-quality-guardrails.md | issues/2026-03-17_18-57-08-pixiv-quality-guardrails.csv | docs/architecture/*.md,TEST-004,priority:P0 | area:docs | batch:quality-guardrails | done_at:2026-03-17 | evidence:plan+csv+issue-map+system-overview
CORE-004,[P0][core] 保持 seed user 偏好持久化,新增 seed user 查询能力，并让 following sync 在同步时保留/应用 allow_ai 与 allow_r18 偏好。,可读取 seed user 偏好；following sync 不会覆盖已设置偏好；单测通过。,python -m unittest -v tests.test_ingest.IngestTests,none,TODO,TODO,TODO,src/pixiv_artist_recsys/storage/** | src/pixiv_artist_recsys/ingest/** | tests/test_ingest.py,INGEST-001,priority:P0 | area:core | scope:seed-user-preferences
RANK-002,[P0][rank] 实现 quality/AI/R18 guardrails,在 rank 与 live pipeline 中增加 AI/R18 / min-bookmarks / min-score 过滤，减少低质量候选。,可根据 allow_ai / allow_r18 / min_bookmarks / min_score 过滤候选；rank 单测通过。,python -m unittest -v tests.test_rank.RankServiceTests,none,TODO,TODO,TODO,src/pixiv_artist_recsys/rank/** | src/pixiv_artist_recsys/pipeline/** | tests/test_rank.py | tests/test_live_pipeline.py,CORE-004 | PIPE-001,priority:P0 | area:rank | guardrails:quality+ai+r18
APP-004,[P1][app] 扩展 CLI 暴露质量过滤参数,full-recommend 增加 allow-ai/allow-r18/min-bookmarks/min-score 参数，并在输出中展示实际过滤配置。,CLI 可配置质量过滤参数；相关测试通过。,python -m unittest -v tests.test_cli.CLITests,none,TODO,TODO,TODO,src/pixiv_artist_recsys/cli.py | tests/test_cli.py,RANK-002,priority:P1 | area:app | interface:cli
TEST-005,[P1][test] 完成第五批回归与计划同步,运行第五批测试与全量回归，更新本批 CSV regression 状态与 plan checklist。,python -m unittest -v 与 compileall 均通过；本批 issue regression 状态为 DONE。,python -m unittest -v && python -m compileall -q src tests,none,TODO,TODO,TODO,issues/2026-03-17_18-57-08-pixiv-quality-guardrails.csv | plan/2026-03-17_18-57-08-pixiv-quality-guardrails.md | tests/**,DOCS-005 | CORE-004 | RANK-002 | APP-004,priority:P1 | area:test | batch:quality-guardrails
